{
  "schema_version": "account_equity_panel.v1",
  "workbench": "Account Workbench",
  "panel": "Account Equity Panel",
  "route": "/accounts/{account_id}/equity",
  "fixture_state": "blocked",
  "context": {
    "trading_day": "2026-06-14",
    "session_id": "account-workbench.fixture.20260614.005",
    "run_id": "account-equity.fixture.blocked.001",
    "reducer_checkpoint_id": "account-equity.checkpoint.blocked.001",
    "reducer_checkpoint_ts": "2026-06-14T15:11:33Z",
    "stream_state": "blocked",
    "projection_owner": "account-console-contracts",
    "source_authority": "typed_blocker"
  },
  "account": {
    "account_id": "acct.demo-19053",
    "account_alias": "19053",
    "account_kind": "real_feed_sandbox_paper"
  },
  "equity_points": [
    {
      "point_ts": "2026-06-14T15:00:00Z",
      "equity": null,
      "balance": null,
      "available_cash": null,
      "margin": null,
      "ledger_ref": null,
      "curve_ref": "fixture://account-workbench/equity/acct.demo-19053/blocked",
      "source_ref": "fixture://account-workbench/equity/acct.demo-19053/blocked-missing-ledger",
      "checksum": "sha256:a5a5a5a5a5a5a5a5a5a5a5a5a5a5a5a5a5a5a5a5a5a5a5a5a5a5a5a5a5a5a5a5"
    }
  ],
  "blockers": [
    {
      "blocker_id": "account-console.p004.phase5.equity-ledger-ref-missing",
      "severity": "high",
      "kind": "missing_equity_ledger_ref",
      "owner": "external ledger owner",
      "next_action": "Provide ledger-derived equity point refs before equity UI closeout.",
      "source_ref": "fixture://account-workbench/blockers/p004/phase5/equity-ledger-ref-missing",
      "checksum": "sha256:a6a6a6a6a6a6a6a6a6a6a6a6a6a6a6a6a6a6a6a6a6a6a6a6a6a6a6a6a6a6a6a6"
    }
  ],
  "source_refs": [
    {
      "kind": "typed_blocker",
      "owner": "account-console-contracts",
      "source_ref": "fixture://account-workbench/blockers/p004/phase5/equity-ledger-ref-missing",
      "checksum": "sha256:a6a6a6a6a6a6a6a6a6a6a6a6a6a6a6a6a6a6a6a6a6a6a6a6a6a6a6a6a6a6a6a6",
      "authority": "typed blocker fixture; not equity truth"
    }
  ],
  "boundaries": {
    "read_only_projection": true,
    "runtime_truth": false,
    "account_truth": false,
    "order_truth": false,
    "ledger_truth": false,
    "ui_truth": false,
    "paper_ready": false,
    "live_ready": false,
    "broker_tradable": false,
    "admission_truth": false,
    "capital_truth": false,
    "action_controls": false
  },
  "rejection_rules": [
    "Reject blocked equity fixture as ledger-backed curve.",
    "Reject browser-side equity repair."
  ]
}
